id,menu-order,name,touchimage,bioimage,content
25,24,George S. Schuyler ,25schuyler.jpg,b25schuyler.jpg,"<i>Photographed by Van Vechten July 2, 1941</i><br><br> George Schuyler thrived on iconoclasm and controversy. A brilliant journalist, novelist, and satirist, he was proudly and perpetually out of touch with the mainstream political and social currents of his times. Born in 1895, Schuyler served in the Army for several years and was briefly imprisoned for desertion. After moving to New York in 1919, he was hired by labor organizer A. Philip Randolph to work at <i>The Messenger</i>, a socialist magazine. In his regular column, “Shafts and Darts: A Page of Calumny and Satire,” Schuyler lampooned everyone from W. E. B. Du Bois to Marcus Garvey and developed his trademark style. In 1924, Schuyler became a correspondent for the <i>Pittsburgh Courier</i>, where he wrote both satire and editorials. He married Josephine Codgell, a white woman from Texas, in 1931; their daughter Philippa Duke Schuyler was a famous musical prodigy. <br><br> One of Schuyler’s best-known essays, “The Negro Art Hokum,” (1926) was published in <i>The Nation</i> alongside Langston Hughes’s more well-known essay “The Negro Artist and the Racial Mountain.” In contrast to Hughes’s conviction that black artists must draw inspiration from the materials of black vernacular culture, Schuyler rejected the very idea that art could be “expressive or characteristic of the Negro race” – a controversial viewpoint in the context of the Harlem Renaissance. In <i>Black No More</i> (1931), a science fiction novel, Schuyler mocked the absurdity of American racial hierarchies by imagining a treatment that would allow black people to become white.<br><br> After World War II, Schuyler’s politics moved sharply right. He became a staunch anticommunist, denounced Martin Luther King, and declared the civil rights movement an anti-American plot. His autobiography, <i>Black and Conservative</i>(1966), details his anti-civil rights, right-wing politics. By the time of his death in 1977, Schuyler was nearly forgotten among African American writers due to the extreme views he had come to espouse."
26,20,Nella Larsen,26larsen.jpg,b26larsen.jpg,"<i>Photographed by Van Vechten August 17, 1932</i><br><br> The daughter of a white Danish mother and a black West Indian father, Nella Larsen explored issues of racial identity and identification in her groundbreaking novels, <i>Quicksand</i> (1928) and <i>Passing</i> (1929). Along with her contemporary, Zora Neale Hurston, Larsen was one of the most important female voices of the Harlem Renaissance. Born in Chicago, she was educated at Fisk University, the Lincoln Hospital Training Program, and the New York Public Library’s librarian training program. Throughout her writing career, Larsen worked as a nurse and as a children’s librarian.<br><br> Carl Van Vechten was an early supporter of Larsen’s work. He introduced her to his publishers, Blanche and Alfred Knopf, who later issued both her novels. <i>Quicksand</i> was inspired in part by Larsen’s experiences in Harlem, the southern United States, and abroad. The novel’s main character, Helga Crane, is the daughter of a white mother and black father, and her efforts to fit into various white and black communities are unsuccessful. Larsen’s second novel, <i>Passing</i>, is the story of Clare Kendry, a mixed-race woman who passes for white and marries a white man, but eventually feels compelled to spend time with African Americans in Harlem. <i>Passing</i> was not as well-received as <i>Quicksand</i>; nevertheless, many agreed with a review which deemed it “an earnest and courageous attempt to deal with the whole theme, not just part of it selected as suitable for racial defense or propaganda.” <br><br> In spite of her literary success, Larsen went back to nursing and worked at a Brooklyn hospital for 30 years. The success of <i>Quicksand </i> and <i>Passing</i> suggests that had she continued to write, she would likely have developed ever-greater skill. Though her books were out of print for decades, she has regained a reputation as a writer whose work reveals the complexity of her subject with sensitivity and clarity."
27,50,Carl Van Vechten,27vanvechten.jpg,b27vanvechten.jpg,"<i>Self-portrait April 3, 1934</i><br><br> Carl Van Vechten was a champion of African American culture and one of the central figures of the Harlem Renaissance. He befriended, photographed, wrote about, and corresponded with many of the movement’s stars. A generous patron, he provided financial support and connected black writers to prominent publishers. At the same time, Van Vechten wrote a controversial novel about Harlem called <i>Nigger Heaven</i> and attracted criticism for what some saw as a voyeuristic fascination with black life. For these reasons, he remains a controversial figure. <br><br> Van Vechten grew up in Iowa and moved to New York in 1906. His first job in the city was as a music critic at the <i>New York Times</i>; he would go on to write several books of music criticism, as well as many novels. Following a brief first marriage, he married his second wife, the actress Fania Marinoff, in 1914. Their relationship lasted for over 40 years, despite the fact that Van Vechten often had male lovers. <br><br> Van Vechten counted many literary luminaries among his friends. He developed a close relationship with Gertrude Stein, eventually becoming her literary executor. Zora Neale Hurston liked him immensely, once remarking, “If Carl was a people instead of a person, I could then say, ‘These are my people.’” Langston Hughes considered him a mentor, and James Weldon Johnson was a close confidante. Others gave Van Vechten a frostier reception – notably W. E. B. Du Bois, who wrote a scathing review of <i>Nigger Heaven</i>.<br><br> In the 1930s, Van Vechten turned a longtime interest in photography into a profession. He produced nearly 20,000 photographs, including portraits of countless celebrated figures. Another passion was collecting: books, clippings, manuscripts, programs, correspondence, and more. In 1941, his book collection and archive of materials related to African American life became the basis for the James Weldon Johnson Memorial Collection of Negro Arts and Letters."
28,47,Augusta Savage,28savage.jpg,b28savage.jpg,"<i>Photographed by Van Vechten July 9, 1938</i><br><br> Augusta Savage combined her talent as a sculptor with a commitment to supporting other black artists. A Florida native, Savage nurtured her early creativity by sculpting red clay from her family’s backyard. She moved to New York with only $4.60 to her name and was accepted to study at Cooper Union. In 1923, the art school in Fontainebleau, France awarded her a scholarship and then retracted it following complaints from white students. The incident garnered public attention as black newspapers decried the “color line in art.” <br><br> From 1929 to 1931, Savage studied in Paris. Her sculpture from this period, which includes works like <i>Danseur nu</i> and <i>The Amazon</i>, depicts the black body with detail and dignity. Yet because Savage often could not afford bronze, and worked instead in clay or plaster, many of her sculptures are now lost. <br><br> Returning to Harlem at the height of the Depression, Savage dedicated herself to teaching young African American artists. Her students included Norman Lewis, Ernest Crichlow, and Jacob Lawrence. For years, she provided free instruction from her 143rd Street studio, and in 1937 she opened the Harlem Community Art Center. As a supervisor on the Federal Art Projects, she advocated for increased representation of black artists, helping them obtain much-needed jobs. <br><br><i> The Harp </i> (1939) epitomizes the mixed fortunes of Savage’s career. Commissioned for the World’s Fair in New York and inspired by the anthem “Lift Every Voice and Sing,” the celebrated work was destroyed after the fair because Savage could not afford to preserve it. Her legacy, though, lives on through the network of artists for whom she was a mentor and advocate. ""I have created nothing really beautiful, really lasting,” Savage once reflected, “but if I can inspire one of these youngsters to develop the talent I know they possess, then my monument will be in their work.”"
29,37,J. Rosamond Johnson,29jrjohnson.jpg,b29jrjohnson.jpg,"<i>Photographed by Van Vechten April 22, 1933</i><br><br>In awe of his subject’s stunning “musical versatility,” an early biographer of J. Rosamond Johnson marveled that “he is unclassified.” The characterization proved prescient. Throughout his long career, Johnson flourished as a performer, composer, director, anthologist, arranger, and critic, crossing borders of genre and form at every turn. <br><br> Born in Jacksonville, Florida in 1873, Johnson began playing the piano at age four, gave his first public performance at eight, and held the position of organist at the Ebenezer Methodist Episcopal Church by 12. After studying at the New England Conservatory of Music, he toured with the show <i>Oriental America</i>, then returned to Jacksonville to work as a music supervisor for the city’s schools. Later endeavors included a stint as music director at Oscar Hammerstein’s London Opera House, a directorship at the New York Music School Settlement in Harlem, tours with a vaudeville group, performances of the spirituals with the singer Taylor Gordon, and a role as Lawyer Frazier in the premiere of <i>Porgy and Bess</i>.<br><br> In addition to these solo pursuits, Johnson maintained a longstanding partnership with his brother James Weldon Johnson. Their collaboration began in childhood when, James Weldon once recalled, the brothers stood “close by on either side while [our mother] picked out hymns or other simple pieces. It was our great delight, my brother at one end of the keyboard and I at the other, to chime in with what were then wholly futuristic harmonies.” The two brothers worked together to produce <i>The Book of American Negro Spirituals</i>. With the vaudevillian Bob Cole, they also formed a songwriting trio that produced three full-length shows and an astonishing number of popular hits. As Johnson proudly noted, the group’s aim was to “[turn] the tide” in American songwriting from the racist genre of the “coon song” to black-authored “American Story-Songs, ballads, and songs of love.”<br><br> Among Johnson’s many contributions to American musical and cultural life, perhaps the most enduring is “Lift Every Voice and Sing.” Written in 1900 for a Jacksonville children’s choir (he composed the music, his brother the lyrics), the song later became known as the official song of the NAACP and the unofficial “Negro National Anthem.” Surely Johnson was correct when he called it “our greatest contribution as a song, that will always live.”"
30,39,Blanche Knopf,30bknopf.jpg,b30bknopf.jpg,"<i>Photographed by Van Vechten April 4, 1932</i><br><br> A native New Yorker, Blanche Wolf Knopf met her husband, Alfred A. Knopf, in 1911 when he was a senior at Columbia University and an aspiring publisher. Blanche shared Alfred’s ambition to start a publishing house, and they were soon engaged. The two realized their goal in 1915, starting their press with $5,000 from Alfred A. Knopf’s father and space in his New York office. The couple married in 1916. <br><br> In the press’s early years, the Knopfs were involved in all aspects of the publishing process, from soliciting and editing manuscripts to designing and marketing books. From the beginning, Blanche was active in all areas of the business, including designing the Borzoi, a Russian wolfhound imprint marking Knopf titles. Blanche Knopf was soon vice president and director of the already thriving business and she earned a reputation as an influential and powerful editor. Throughout the more than 50 years Knopf worked in publishing, she was a force in shaping the American literary marketplace and the nature of American book publishing. During her tenure with the firm, Knopf published the work of 11 Nobel Prize winners as well as 18 Pulitzer Prize-winning titles. <br><br> Though Blanche Knopf is often associated with the European writers whose work she edited and published—Sigmund Freud, André Gide, Simone de Beauvoir and her close friend Albert Camus—she also worked closely with American writers including Willa Cather, H.L. Mencken, Langston Hughes, and Carl Van Vechten. In the 1920s, Van Vechten encouraged the Knopfs to publish the work of a number of talented African American writers, including Langston Hughes and Nella Larsen. By publishing the work of these influential writers, the Knopfs were important participants in and supporters of the literature of the Harlem Renaissance."
31,42,Rouben Mamoulian,31mamoulian.jpg,b31mamoulian.jpg,"<i>Photographed by Van Vechten November 7, 1935</i><br><br> Rouben Mamoulian made a lasting impact on American culture as the director of landmark musicals and movies. Born to a wealthy family in Tbilisi, Georgia, he began his career by studying experimental theater in Moscow and directing plays in London. He moved to the United States in 1923, when the philanthropist George Eastman recruited him to work for the newly formed American Opera Company in Rochester, New York. <br><br> Mamoulian’s first major success in the United States was Dubose and Dorothy Heyward’s <i>Porgy</i>, which he directed for the Theater Guild in 1927. Eight years later, he became the director of its wildly popular successor, the Gershwins’ <i>Porgy and Bess</i>. Scholars have recently rediscovered Mamoulian’s significant creative influence on the opera, including the fact that he wrote some of its most memorable lines. <br><br> Mamoulian was also a respected film director. His first movie, <i>Applause</i>(1929), launched a successful run of more than a dozen Hollywood films, many of which made pioneering use of Technicolor and new sound technologies. Both onscreen and on Broadway, Mamoulian focused on synthesizing sound and image in innovative ways. He played a key role in developing the integrated Broadway musical – works that combine music and story into a unified whole. As the director of <i>Oklahoma!</i> (1943) and <i>Carousel</i> (1945), he brought some of the era’s most successful musicals to life. <br><br>Mamoulian’s creative aesthetic, which he called “stylization,” rejected naturalism in favor of highly formalized acting, rhythmic vigor, and visual spectacle. To his mind, this aesthetic had a social purpose. As he once told an interviewer, “The world today is so full of violence, obscenity, war, the failure of political systems. I try to make movies that make people a bit more confident. But that doesn't mean being sugary. A film must have two elements - it must deal with the real world and show how it could be made better.”"
32,31,George Gershwin,32gershwin.jpg,b32gershwin.jpg,"<i>Photographed by Van Vechten March 28, 1933</i><br><br> George Gershwin described one of his most famous compositions, <i>Rhapsody in Blue</i>, as a “musical kaleidoscope of America, of our vast melting pot, of our unduplicated national pep, of our metropolitan madness.” These words capture the spirit of his music, which offers a vibrant sonic image of early-twentieth-century America. <br><br> Gershwin was a child of a complex, multiracial urban environment: born to Russian Jewish immigrant parents in Brooklyn, he played the piano from an early age and quit high school to work as a song plugger and Broadway rehearsal pianist. Along the way, he devoured a rich array of musical influences, from Tin Pan Alley tunes to French impressionism to the radical twelve-tone compositions of Schoenberg. He often worked in collaboration with his brother Ira, a lyricist. <br><br> African American music was at the heart of Gershwin’s myriad musical endeavors, which ranged from popular song to orchestral works to opera. <i>Blue Monday</i> (1922), an early work, is a small-scale opera about life in Harlem that included white singers in blackface. The perennially popular <i>Rhapsody in Blue </i>(1924) is a masterpiece of hybridity that merges syncopated rhythms with jazz harmonies, klezmer-inspired motifs, and lush melodic gestures. <i>Porgy and Bess</i> (1935) prompted J. Rosamond Johnson to praise Gershwin as “the Abraham Lincoln of Negro music.” Characterized as a “folk opera,” it engendered admiration and criticism in equal measure among contemporary audiences. White theatergoers valued the work for its apparent “authenticity,” while African American critics had a mixed response: many were wary of the way Gershwin employed racial stereotypes, but they also recognized that the opera provided unprecedented performance opportunities for black artists. Despite, or perhaps because of, such controversy, <i>Porgy and Bess</i> became a staple of the American repertoire. Tragically, Gershwin died just two years after the opera’s premiere, succumbing to a brain tumor at the age of 38."
33,43,Rose McClendon,33mcclendon.jpg,b33mcclendon.jpg,"<i>Photographed by Van Vechten November 19, 1935</i><br><br> Regarded as the “First Lady of the Stage,” Rose McClendon was one of the most celebrated African American actors of her generation. After moving to New York from South Carolina as a child, she gained her first acting experience in church plays. Her breakthrough performance came in 1926, when she received rave reviews for her minor role in <i>Deep River</i> on Broadway. Star turns in Paul Green’s <i>In Abraham’s Bosom</i>, Dubose Heyward’s <i>Porgy</i>, and Langston Hughes’s <i>Mulatto</i> made her the most eminent African American woman on the contemporary stage. The <i>New York Times</i> later noted that “scarcely an important play of Negro life was seen in New York that did not include her in its cast.” <br><br> The question of “what makes a Negro theatre” was at the forefront of McClendon’s professional life. In her view, successful black theater involved not simply the appearance of African Americans on stage, but also “plays that deal with Negroes, with Negro problems, with phases of Negro life, faithfully presented and accurately delineated.” She put these ideas into practice in her own work. A member of the advisory board of the Harlem Experimental Theater, McClendon explored directing and playwriting, co-authoring a play called <i>Taxi Fare</i> with Richard Bruce Nugent in 1931. In 1935, she and Dick Campbell co-founded the Negro People’s Theater, which she deemed “a cultural experiment…based upon a program of social realism.” Their goal was to create space for the establishment of a full-fledged black theatrical tradition. Subsequently, she helped create the Negro Units of the Federal Theater Project, including a Harlem-based unit that employed more than 500 African Americans. Her untimely death from pneumonia in 1936 meant she was never able to realize this goal fully, but her influence lived on through the Rose McClendon Players, which Campbell established in her memory."
34,35,Charles S. Johnson,34csjohnson.jpg,b34csjohnson.jpg,"<i>Photographed by Van Vechten April 25, 1947</i><br><br> Charles S. Johnson has been called an “entrepreneur of the Harlem Renaissance” due to his skill in promoting black cultural achievement and creating opportunities for African American artists and writers. A distinguished sociologist, he was confident in the ability of culture to combat racism and believed that artistic expression represented “the road to a new freedom” for African Americans. <br><br> Born and raised in Virginia, Johnson attended Virginia Union University, a historically black institution, before earning a Ph.D. in sociology from the University of Chicago in 1918, studying with Robert Park, a founder of the “Chicago School” of sociology. Following Chicago’s devastating 1919 riot, Johnson became the major author of the report <i>The Negro in Chicago</i>, which analyzed the deep roots of racial violence in the city. <br><br> Johnson moved to New York in 1921 to become research director of the National Urban League. He continued to direct research projects while becoming increasingly involved in the creative milieu of the Harlem Renaissance. In 1923, he founded and became the editor of <i>Opportunity</i>, the League’s journal. <i>Opportunity</i> proved a key platform for African American writers, and its literary contests helped launch the careers of Langston Hughes, Countée Cullen, Zora Neale Hurston, and many others. Johnson also hosted the landmark 1924 Civic Club dinner, which brought together African American literary stars and influential white publishers like Alfred Knopf. In 1928, Johnson left New York to teach at Fisk University; he eventually helped to recruit James Weldon Johnson and Aaron Douglas, as well as other exceptional faculty. In 1946, Johnson became the first African American president of Fisk. <br><br> Johnson maintained a lifelong faith in the power of art and scholarship to bring about social change, and some prominent black intellectuals, including W. E. B. Du Bois, critiqued him for being insufficiently radical in his demands for civil rights. Yet there is no doubt that Johnson made a significant impact through his commitment to scholarly research and his cultivation of black creative talent.  "
35,44,Richard Bruce Nugent,35nugent.jpg,b35nugent.jpg,"<i>Photographed by Van Vechten February 16, 1936</i><br><br>The artist and writer Richard Bruce Nugent was born in 1906 in Washington, D.C. to a socially elite African American family. After attending the city’s distinguished Dunbar High School, Nugent moved with his family to New York City at the age of 13. There, he worked as a bellhop and art apprentice while studying at the New York School of Industrial Arts and Traphagen School of Fashion. <br><br> A colorful personality and gifted conversationalist, Nugent established connections with many leading figures of the Harlem Renaissance. One of his mentors was Alain Locke, who published Nugent’s short story “Sahdji” in the anthology <i>The New Negro</i> (1925). Along with Langston Hughes, Wallace Thurman, Gwendolyn Bennett, Zora Neale Hurston, and others, Nugent was a major contributor to the short-lived journal <i>Fire!!</i> (1926). Although it folded after only one issue, <i>Fire!!</i> was of enormous symbolic importance. It rejected the conservative attitudes of an older generation of African American artists and their white patrons and declared that the younger generation, unencumbered by tradition, would chart new artistic territory. Nugent contributed two drawings and a short story, “Smoke, Lilies and Jade,” that depicted a romantic relationship between two men. Although certainly not the only gay man to occupy a prominent place in the Harlem Renaissance, Nugent was unusual among African American writers of the era for his openness about his sexuality. <br><br> Nugent was also involved in the performing arts: he appeared in the cast of <i>Porgy</i> (the precursor to <i>Porgy and Bess</i>), joined a ballet company, and danced in Hall Johnson’s “Negro Folk Drama” <i>Run, Little Chillun</i>. Later, he helped found the Harlem Cultural Council and continued to write and paint. During the last decades of his long life – he lived until 1987 – his sharp memory and wealth of brilliant stories made him a key source of firsthand information about the Harlem Renaissance. "
36,48,Noble Sissle,36sissle.jpg,b36sissle.jpg,"<i>Photographed by Van Vechten November 20, 1951</i><br><br>Noble Sissle wore many musical hats: composer, bandleader, singer, lyricist, and player of the “bandolin” (a banjo-mandolin hybrid). The son of a pastor and schoolteacher, he grew up singing in church choirs and glee clubs in Indianapolis. In 1915, Sissle began a musical partnership with Eubie Blake that would last for more than six decades. Initially, both men worked for James Reese Europe, the leader of New York’s famed Clef Club Orchestra. After Europe’s untimely death in 1918 – he was murdered by a deranged member of his orchestra – Sissle and Blake toured as the Dixie Duo, a vaudeville act. <br><br> The pair’s most significant contribution was the 1921 musical <i>Shuffle Along</i>. Langston Hughes called it the show “that gave a scintillating send-off to that Negro vogue in Manhattan.” The first musical of its era to feature a black cast and creative team, <i>Shuffle Along</i> ran for more than 500 performances. It was so popular that it shut down traffic on the block outside the Sixty-Third Street Theater on account of the teeming crowds gathered outside. Sissle and Blake wrote the score, while comedians Flournoy Miller and Aubrey Lyles wrote the book. If the story, a convoluted tale of a mayoral race in a southern town, did not stand the test of time, the music certainly did. Songs like “I’m Just Wild About Harry” and “Love Will Find A Way” have become standards, and the entire musical was reworked as a Broadway show in 2016. <br><br> Although Sissle and Blake never replicated the success of <i>Shuffle Along</i>, Sissle stayed active on the arts scene as a composer, recording artist, and community leader. In 1937, he became the first elected president of the Negro Actors Guild of America. In 1950, he was named the honorary mayor of Harlem, an indication of the lasting significance of his artistic work. "
